{
  "chunks_size": 1000,
  "codebase_version": "v2.1",
  "data_path": "data/chunk-{episode_chunk:03d}/episode_{episode_index:06d}.parquet",
  "features": {
    "action": {
      "dtype": "float32",
      "names": [
        "a0",
        "a1",
        "a2",
        "a3"
      ],
      "shape": [
        4
      ]
    },
    "episode_index": {
      "dtype": "int64",
      "names": null,
      "shape": [
        1
      ]
    },
    "frame_index": {
      "dtype": "int64",
      "names": null,
      "shape": [
        1
      ]
    },
    "index": {
      "dtype": "int64",
      "names": null,
      "shape": [
        1
      ]
    },
    "observation.images.top": {
      "dtype": "image",
      "names": [
        "height",
        "width",
        "channels"
      ],
      "shape": [
        2,
        2,
        3
      ]
    },
    "observation.state": {
      "dtype": "float32",
      "names": [
        "s0",
        "s1",
        "s2",
        "s3"
      ],
      "shape": [
        4
      ]
    },
    "task_index": {
      "dtype": "int64",
      "names": null,
      "shape": [
        1
      ]
    },
    "timestamp": {
      "dtype": "float32",
      "names": null,
      "shape": [
        1
      ]
    }
  },
  "fps": 10,
  "robot_type": "so100",
  "splits": {
    "train": "0:2"
  },
  "total_chunks": 1,
  "total_episodes": 2,
  "total_frames": 20,
  "total_tasks": 1,
  "total_videos": 0,
  "video_path": null
}
