{
    "codebase_version": "v2.1",
    "robot_type": "so100",
    "total_episodes": 2,
    "total_frames": 20,
    "total_tasks": 1,
    "total_videos": 0,
    "total_chunks": 1,
    "chunks_size": 1000,
    "fps": 10,
    "splits": {
        "train": "0:2"
    },
    "data_path": "data/chunk-{episode_chunk:03d}/episode_{episode_index:06d}.parquet",
    "video_path": null,
    "features": {
        "observation.state": {
            "dtype": "float32",
            "shape": [
                4
            ],
            "names": [
                "s0",
                "s1",
                "s2",
                "s3"
            ]
        },
        "action": {
            "dtype": "float32",
            "shape": [
                4
            ],
            "names": [
                "a0",
                "a1",
                "a2",
                "a3"
            ]
        },
        "observation.images.top": {
            "dtype": "image",
            "shape": [
                2,
                2,
                3
            ],
            "names": [
                "height",
                "width",
                "channels"
            ]
        },
        "timestamp": {
            "dtype": "float32",
            "shape": [
                1
            ],
            "names": null
        },
        "frame_index": {
            "dtype": "int64",
            "shape": [
                1
            ],
            "names": null
        },
        "episode_index": {
            "dtype": "int64",
            "shape": [
                1
            ],
            "names": null
        },
        "index": {
            "dtype": "int64",
            "shape": [
                1
            ],
            "names": null
        },
        "task_index": {
            "dtype": "int64",
            "shape": [
                1
            ],
            "names": null
        }
    }
}